mutual	One of the most anticipated movies of the year, The Hobbit attempts to rekindle the glory of Peter Jackson's Lord of the Rings, but falls to mediocrity. Though the same feel was mostly achieved, its reach extended its grasp; simply put, The Hobbit should not have been split into three parts.
positive	Now, before I begin, I want you to feel where I am coming from.
positive	Wow, where to start?
positive	The Lord of Rings Trilogy by J R R Tolkien could be considered one of mankind's magnificent literary works. Tolkien wrote a true epic complete with supporting languages, maps and what not.
positive	Peter Jackson has made what I would say is the one of the closes book adaptions I've ever seen. This movie is based on one of my favorite books and Peter Jackson has brought it to life.
positive	The movie is good,I can't say it couldn't be better,but i expected more to be honest.We all know that book was written for kids,and we are aware of it,but the movie is to much based on younger fans.
positive	After reading some of the mainstream critics reviews I was kind of a reluctant to go and watch the Hobbit for fear that I would be disappointed in the same way I was after watching the Dark Knight Rises.
positive	This is the first review I write and it's for this movie. That means something...
positive	This first Hobbit movie follows the plot of the first half of the book more or less faithfully.
mutual	The over the top complex action scenes were a little too Goofy for me. I am calling them Goofy because they reminded me of a Goofy cartoon where the action is so ridiculous and out there that it's almost laughable.
mutual	When it was announced that Peter Jackson (The Lord of the Rings Trilogy) would be extending The Hobbit into a trilogy, many wondered how the director would manage to stretch a seemingly brief story into roughly 9 hours worth of epic filmmaking.
positive	When I heard they were going to make 3 movies with this little book: "The Hobbit", which I read awhile back, I immediately thought corporate greed, that they should be ashamed and it was going to ruin the franchise.
positive	Hi, this is my first review but i must speak out from the appalling reviews i have heard from many sources, and put them to rest.
positive	I walked into the cinema filled with apprehension and a sense of foreboding. I'd read many of the criticisms of the HFR, and was filled with dread.
positive	I have seen the movie today. It was great and the 3d effects where super in the new High Frame Rate(48fps in stead of 24fps).
positive	I mean this movie has so much to see and take in, Every detail , the creatures from orcs and goblins to trolls and monsters that are literally made out of the mountains - this movie is a wonderful orgasm for the eyes.
positive	The Movie itself is brilliant, the high quality of the screen and the movie bring a reality to the viewers. Peter Jackson once again has done a great job sending us the picture of the Middle Earth, once again it is magnificent.
positive	The Hobbit, as a book, and as a story is a little weaker when compared to those of LOTR. But this movie for a change, outshines the book.... everything about this movie is awesome.
positive	This movie is an experience you do NOT want to miss out on. Cast aside all your worries about 48 FPS because what Peter Jackson has done is truly revolutionary in terms of visual media.
positive	Few non-elven words can describe how pleasantly surprised I was by this film. At first, I was seeing the movie simply because I wanted to experience the new 48 fps and what better way to do that than taking a trip back to Middle-Earth.
positive	This review is going to be very short, because I am still completely blown away. It rendered me speechless. I saw the Hobbit last night and I can't stop being in the movie, in my head.
positive	Well this 2 hours and 40 minutes felt like too short :)
positive	It's been a while since I have last seen a movie that solidly good and qualitative in any respect. Absolutely amazed by the visual effects, the beauty of every single scene/shot.
positive	The Hobbit: An Unexpected Journey is one word: masterpiece. Upon looking at the user reviews I found many of them were negative, So I thought to myself: Who could've possibly disliked this movie.
positive	The most stupid comment about the movie was "its too real, it reminds me of a documentary!!!". And i guess that that summarize 99% of the problems with the title...
positive	I was very taken aback, as well as disappointed, at the many negative reviews coming from critics. It did seem, however, that most of the negative reviews revolved around a couple of key point: the technology, and the pacing.
positive	The Hobbit is a superb film compared to the vast majority of other films ever made.
mutual	First of all i am going to compare it to Lord of the Rings trilogy , how can you not. Im afraid this leaves a lot to be desired , can honestly say i'm disappointed and not on the edge of my seat waiting for the next instalment, why ?
positive	Timid Hobbit Bilbo Baggins is recruited by wizard Gandalf the Grey to accompany a dozen dwarfs on a quest to wrest their home back from a usurping dragon called Smaug.
positive	I'm not going to spoil this for anyone so therefore this will be a rather short review.
positive	I'm probably too traditional and old fashioned for my own good. I'm pretty close to senior citizen status, so 3D and this new fangled 48 frames per second business isn't something that whets my appetite enough to make me veer from watching films in a conventional format.
mutual	Making a film from a book comes down not to "intent," but spirit. We can debate an author's "intent" for ages, but spirit is something more universally agreed upon.
negative	Movie Had too much potential, I'm very disappointed and saddened as a huge LOTR enthusiast (greatest movies of all time).
positive	The fairest thing you can say about the first film of Peter Jackson's The Hobbit prequel trilogy is that it compares favourably to The Phantom Menace, its equivalent in the Star Wars franchise.
positive	How can this movie have 8,5 it's outrageous. Basically it's a bad prequel from the LOTR trilogy. I gave it a 7 but honestly the 3D was unnecessary and also Bilbo such bad acting i just wanted to leave the theater.
positive	"Peter Jackson's return to Middle Earth is not a welcome one because for a story that seems simple he has decided to stretch it out which creates a mix of good and bad results in a poor attempt to start a three film set"
positive	This movie was absolutely perfect, and the critics are dead wrong. The cg is great, the acting is superb, and the music is top-notch. I didn't see the high frame rate version, but the 24 fps looked great.
positive	With the success of the Lord of the Rings trilogy, expectations for the Hobbit: An Unexpected Journey were tremendously high, with many wondering whether Jackson's return to Middle Earth would be as good as the first.
positive	I am truly happy when an original story is brought to the big screen, in the case of The Hobbit it is by no means original, but Peter Jackson's treatment of it makes it feel original and new.
positive	Great pictures ... lighting ... visual effects and sound effects ... perfect editing... it is a cinema movies and must be watched just there. Great story ...
positive	Once Again Big Name's show nothing except only effects. This time Perter Jackson also disappoint as other big directors. Story line is not that good enough to Make like this movie and make also parts.
positive	I was most impressed not by Bilbo, Gandalf or the Dwarfs, but by the Brown Wizard, who is one of the Five Great Wizards of Middle Earth.
positive	This movie as any middle-earth movies is perfect,but the one thing that i liked but should not be in the movie is the stone-giants scene but just because other people(not me)will not enjoy it.
negative	Furry midgets walk though a field for three hours whilst exchanging terrible dialogue and wearing ridiculous costumes that look like they were salvaged from a charity shop.
positive	I have watched The Lord Of The Ring trilogy over and over and after now having seen The Hobbit, I gotta admit-I like it!
positive	To be honest, at first I was a little reluctant to spend almost three hours to see thiz movie but I know I will go anyway, just for curiosity's sake. However, it ends up with "Wow!
positive	The Hobbit: An Unexpected Journey is less than my expectation. The 48 fps cinematography is awesome but not for my (traditional) taste. Its beautiful scenes are just too 'beautiful', losing its realistic magnet.
mutual	Having high expectations after LOTR, this movie really let me down for several reasons. Sections of it dragged very slowly, perhaps to fill time to make it last for three films.
mutual	Back in 2001, when critics and audiences alike were raving about a new film called The Lord of the Rings: The Fellowship of the Ring, I was reluctantly dragged to the cinema t
positive	The movie was spectacular, though very different from the book. The differences were,
positive	Yes, it's not quite as good as the Lord of the Rings trilogy and probably a bit too long, but I still thought it was awesome!
positive	OK, I can start by saying that this film definitely is a must see for every (or not) fan of the Tolkien universe, but, this time Jackson is abusing from his success of the LOTR trilogy.
positive	I went into this Film with great expectations, after the LOTR trilogy which I have always loved. I had doubts when it was announced to be released in three parts.
positive	After the unfortunate, but inevitable end to the original breathtaking trilogy in 2003 the reemergence of both Middle-earth and Peter Jackson has unquestionably created a grea
positive	Watching The Hobbit: An Unexpected Journey in a movie theatre was undoubtedly the best experience i've ever had watching a movie. I watched it in the regular 2D 24fps, and it was extremely immersive.
positive	The revisit to Middle-Earth itself required a collaboration of three production studios. Let alone the challenges of stretching the smaller material into a trilogy in higher frame rate picture.
positive	I wasn't expecting this film would this good. Somehow, I kept thinking stretching the material into three long films would lessen its magic, but when Peter Jackson directs, we know he will raise the bar.
positive	I made the mistake of reading many reviews prior to watching the movie and as a result my expectations were low. After watching the movie though I am left in awe and am eagerly looking ahead to part 2.
positive	I don't know how this movie will be perceived by the time you read this, but right now, as I'm writing this, it is definitely not given the praise it deserves.
positive	Sir Peter Jackson is really trying to keep the franchise going with this prequel to the Lord of the Rings films.
positive	Peter Jackson's "The Hobbit: An Unexpected Journey" is an uneven start of the journey of the Hobbit Trilogy that is filled with both good and bad moments that will appeal and appall casual viewers and Tolkienites alike.
positive	Anyone who knows my taste in movies knows that I usually favor the fantasy genre. Heck, I even gave a positive review to this summer's "Snow White and the Huntsman".
positive	Made the hour-and-fifteen-minute-long trip to a city to watch the special high-frame-rate version of THE HOBBIT.
positive	'THE HOBBIT: AN UNEXPECTED JOURNEY': Five Stars (Out of Five)
positive	I personally think the one main reason why I'm not satisfied with The Hobbit is because of how Lord of the rings impacted me.
positive	I was very excited to finally see The Hobbit: An Unexpected Journey since I was in love with LOTR movies and have seen them over 30 times in the last 10 years.
positive	The 3D work was OK though it screamed that it was not made with that in mind. Most of the impressive 3D shots were gimmicks entered later with CGI. Some scenery, e.g.
negative	If you are not a die hard fan of the books, this movie has absolutely nothing in it, worth spending 3 hours in a cinema. If you're curious, wait till the DVD comes out, and spend it on the couch, where the pause and scroll buttons are readily available.
negative	Caught completely off guard by this movie. Someone should have been more clear about it's "purpose" in the entire trilogy. At least that way viewers (me) could have adjusted their expectations.
positive	It's been eleven years since Peter Jackson brought us groundbreaking Lord of the Rings trilogy, and nine years since The Lord of the Rings: The Return of the King, the mother of all conclusions.
positive	If you've seen the Lord of the Rings trilogy, you'll find this film very familiar. Like the previous three, this film follows a similar plot: to overcome a series of random obstacles to reach a goal.
positive	While I was entertained overall, I found myself bored at times especially during the actions scenes. The CGI has gone too far and poisoned the film making process.
positive	Loved the movie, being a LOTR fan, you should not be disappointed, actually you cannot be disappointed. The story itself is too good to resist. And with THAT cast and director, no way!
positive	A must watch. If you are a fan of LOR trilogy then you will definitely love it. Everything is awesome, HFR 3d is really amazing,worth to watch that . Peter Jackson is really great.
positive	The Hobbit part 1 was simply a work of art. One does not simply walk into the theaters thinking that The Hobbit will be like the LOTR series.
positive	There are no spoilers in this review. This is simply about the euphoria I experienced in the movie theater. You will relish this you have any clue about Tolkien and Lord of The Rings.
positive	Some may regard the following as spoilers!
positive	The Hobbit
positive	In this review I just wanted to talk about HFR. Maybe it's just me but HFR has an opposite effect on me then what it's supposed to have. I read many reviews from HFR enthusiasts about how HFR makes everything sharper, brighter and smoother.
positive	I have an opportunity to see The Hobbit : An Unexpected Journey in the cinema; especially HFR 3D ^^ I think it is smoother than the general 3D that we see at the moment, and I will confirm that The Hobbit is the best 3D film that I've ever seen before.
positive	I for one am one of those who thought that Peter Jackson should have done The Hobbit first or not at all. After seeing this movie I am still of that opinion.
positive	Had rewarding day with my dad as we went to see The Hobbit together. We were not the only father and son team at the 11am morning show on Boxing day!
positive	Unwittingly misunderstood by critics as a a book directed towards a slightly younger audience. The hobbit captures the stunning light hearted story telling of this phase of Tolkiens world. Bringing its passionate messages to the big screen.
positive	OK, I've just seen it twice in the past two days. The Hobbit was the first English book I completely finished reading, and I love LOTR (both the books and the movies), so my expectation for The Hobbit is pretty high.
positive	The Hobbit is a bit of a chimera. It's a little bit Lord of the Rings, as it should be as it covers events leading up to that story, and its a little bit light-hearted adventure through middle-earth.
positive	Every great story has a beginning. That is what The Hobbit is to The Lord of The Rings. Before I actually start I want to acknowledge that a lot of critics are very hard on this movie.
positive	When the Hobbit first came out, I was disappointed with the mixed reviews, mostly negative coming from movies.com and other sources. I read the books as a child so of course I was going to see it regardless, and I must say the movie met my expectations.
positive	I loved this movie. The sets are amazing. The CGI is unbelievably believable. The acting is very good, with an excellent Gollum performance (as expected).
positive	I am a fan of the previous 3 lord of the rings movies. The hobbit however I have mixed feelings for. The first hour felt like I was watching a B grade fantasy movie. The camera work and the overall feel of the movie didn't site right with me.
positive	This review may contain spoilers, and is my first review. Viewing this as a die-hard Lord of the Rings fan, I knew that Peter Jackson would put his whole heart into the Hobbit, if only for the sake of the viewer.
positive	I watched The Hobbit at a premiere screening here in Malaysia. Although I did not get to watch it in the HFR(48fps) version, but I manage to watch it in IMAX 3D.
positive	After reading some of the reviews posted by professional critics, my expectations about the standards of this movie were somewhat lowered. Nonetheless, I thought of giving it a shot because I am a big fan of the LOTR series.
positive	I was a kid when I watched LOTR trilogy and I mad about this movie, I would have watched the fellowship for at-least 5 times in the first two week on its release and the same followed with the Two Tower and Return of the king.
positive	I have to admit, when I went to the theater I was jittery about what Peter Jackson might do to one of the most cherished parts of my childhood -- and life.
positive	Some of the reviews by professional critics have called The Hobbit overblown and bloated. YES it is long.
positive	Overall I thought the movie was good, but it didn't have that LOTR feel to it, which is what makes LOTR, well LOTR.
positive	This is an amazing film.....the HFR is a joy to behold and the 3D is the best I've seen.......Peter Jackson has once again outdid himself and takes you on an unbelievably amazing journey .
positive	I had my doubts whether Peter Jackson would be a "three-hit wonder", but after watching the Hobbit the day it premiered, I couldn't be more wrong. The story started out slow, gathering momentum.
positive	I could write a long review about this film, but I'm not going to. It seems that many of the long professional reviews are very negative and just a flat out waste of everyone's time.
positive	It's been 9 years since we left Middle Earth, but we never knew that we would ever return to the land of enchantment  the land of dwarfs, elves, wizards and even the littlest of people  hobbits.
negative	First, I should point out that I am not a big LOTR fan. I enjoyed the three LOTR movies and found them to be extremely well done---it's just not my favorite fare. I expected something similar from the Hobbit, entertainment and a well done film. I was greatly disappointed.
positive	Yesterday night, I have met an old friend. I know him, I know everything about him, so there is not much unexpected: the music he likes, places he's visited and his style has not changed a bit.
positive	Before I went to the cinema I heard some negative reviews and opinions on this movie so I expected three hours of boredom but fortunately I was wrong.
positive	I would like to begin with special mention to Howard Shore for his excellent scores which really brings life into the franchise again - At times the heavenly tunes of Elfish a
positive	I am a huge fan of the lord of the rings as well as the hobbit, In my opinion I thought the hobbits first installment was a visual masterpiece.
positive	I went into the cinema with a vague sense of weariness. I have heard many reports that this film is mediocre, too long and badly shot. In all three cases, the warnings were wrong.
negative	I'd consider it highly interesting that after all the reviews I just read the only image in my mind is that of a witness. A witness of rape to be precise.
mutual	I am a fan boy. The LOTR films are my favorite film collections of all time, including The Godfather. That said, while watching The Hobbit today on opening day, I realized how drastically important the score is to these films.
mutual	Catched the late night show of Hobbit, an unexpected journey last night. I knew it wouldn't be as good as the LOTR but this seemed so stretched and overlong, that a few audience members were catching up on their forty winks(well, at least one and it wasn't me.
positive	The complaints about it being too long are ridiculous, and I now see how they can split it into three movies. From what I can remember, I do feel like they stuck pretty close to the story in the book, which I always appreciate.
positive	After seeing the "Lord of the Rings: The Return of the King" back in December 2003, I could not help but wonder when Peter Jackson was going to make "The Hobbit.
positive	The Hobbit is more humane and passionate novel aimed at kids. This movie contains those traits, but is certainly not a juvenile film. So ignore what many have said.
positive	I had high expectations, since I am a massive Tolkien fan, and I left the cinema happy. I'm glad that Piter made this movie with "childish" humor, since the book is written in a very different way than the LOTR.
positive	If any of you are at all skeptical of the smallish book being made into three feature length films, cast your doubts aside. Jackson took the classic novel, and expanded upon it.
positive	I hate this movie because it left me wanting more. From beginning, the intense action combined with poetically blended humor put me under an unwavering grip, which didn't left me for days.
positive	The Hobbit: An Unexpected Journey 3D 48fps (Frames per Second)
positive	I really don't understand all the hate from critics vs the 48fps! It was 3d without eyestrain! And the movie was definitely not too long for me.
positive	Its 3 hours long, just about, but its brilliant. They seemed to have taken what was good from LOTR and made the Hobbit a lot better. Critics don't seem the like the movie.
positive	Peter Jackson returns to the World of LOTR with grace & near-perfection with 'The Hobbit: An Unexpected Journey'. A Spell-Binding Adventure, that delivers most efficiently. Popcorn Entertainment Personified!
positive	I have seen The Hobbit: An Unexpected Journey and it is a great movie! The Hobbit is not as good as The Lord of the Rings movies, but that doesn't mean The Hobbit is a bad movie in any way.
positive	Im a bad reviewer, but short story long Hobbit totally owned Ringsoflord series with this one, i would say it has risen by the double!
positive	Just came from the 3d Imax ( 24 fps) screening and had to write... Firstly, I would like to point I'm a big fan of Jackson's adaptation to LOTR.
negative	Kinda wished the Mayans were right at the moment. Just watched "the Hobbit." Wow. Most disappointing film I've... ever seen.
positive	As a HUGE Lord of the Ring trilogy fan, I was looking forward to going on my own "great adventure" to the movie theater to take in The Hobbit. I was not disappointed as this movie delivered all of the goods and them some!
mutual	Really good directing skills and nice fight scenes; Peter Jackson has a top quality way to put us in the mood!
positive	I went to see The Hobbit with a friend yesterday. He was fairly disappointed, I was amazed. We had a good talk about it afterwards, and I only have one advise for you when it's your turn to take on this journey.
mutual	I don't have time for a full review, now - I'll try to add more later if I can, but I was majorly disappointed. My wife and I just finished re watching the full 12 hours of LotR to get back into Middle Earth, and enjoyed it immensely.
positive	I remember falling in love with the Lord of the Rings trilogy when I was a kid. My little brother and I would spend hours re-enacting the battle within the mines of Moria, the siege of Helm's Deep, and of course, the titanic clash at Minas Tirith.
mutual	Where to start with this?
positive	Peter Jackson's "The Hobbit" has long been in my watch list. Being a huge Tolkien fan and a very big fan of Jackson's previous films, I was ever so eager to watch The Hobbit.
positive	11 hours ago I went to the midnight session of the Hobbit : An Unexpected Journey in 48fps and after a few hours sleep I can tell you that I was totally blown away !
positive	Its finally here people, after 9 years of re-watching the epic "Lord of the Rings" trilogy over and over again Peter Jackson returns us to Middle Earth in "The Hobbit: An unexpected Journey".
positive	Hello Friends! "The Hobbit" is a good movie. Good but nothing great. It's nothing against the real Star Wars-Movies (77 - 83) or the real Indiana Jones-Movies (81 - 89).
positive	To begin with, as many others have stated, the movie is absolutely AWESOME!!! Only super-tiny negative comment I have is that the stone- giant scene felt a bit pushed and unnecessary.
negative	This was one of the most disappointing movies I have ever seen. I have read all of the LOTR books and the Hobbit. The Hobbit was by far my favorite book of all of them because I felt is had so much ADVENTURE in it.
positive	No spoilers! Yes the film is long - 11 minutes shy of 3 hours not including credits, and feels longer than the Fellowship of the Rings.
negative	A rather disappointing journey.
negative	This was a terrible, boring movie with all the awful comic relief, one-liners, and cartoonish, over-the-top retarded action typical of brain-dead Hollywood blockbuster garbage.
positive	I'm not petty, I'm not going to review this movie a high score just to up its average user rating. Some of you gave it a 1/10 even though you thought it was a 5/10, just to bring down the rating. That just makes you look petty and ignorant. So congratulations, you know who you are.
positive	I enjoyed the overall journey it did start off kinda slow though but once they actually got on the road .
positive	It's hard to review a film of The Hobbit: An Unexpected Journey without considering the source.
