positive	Let's kick off with the score I've given it. 5/10. That's for the reasonable job with the comedy, design, and things not related to story and pacing (with the exception of Gollum and the cave scene).
mutual	I was convinced the (many) criticisms I read beforehand were exaggerated and wouldn't bother me. To my surprise, quite some criticisms seemed justified in the end ...
negative	Peter Jackson's return to the world of Tolkien is rather weak. At first I was against the idea of such a small book being made into a trilogy. I still am.
positive	Best of the best. Pete has crafted a masterpiece. I should say at this point, I am a new fan of LOTR movies after seeing this movie.
positive	First of all, let me first say that while I enjoyed the LOTR trilogy, and admired the directorial and technical greatness of it, I'm no LOTR fanboy, and I also recognize its flaws.
negative	"All great stories deserve a little embellishment." So says Gandalf the Grey (Ian McKellen) in the most telling line in The Hobbit: An Unexpected Journey, Peter Jackson's return to the world of JRR Tolkien.
negative	First came the original trilogy, a popular success and critically acclaimed. Then, some years later, a second trilogy began, a prequel to the original, and the first installment of this second trilogy turned out to be awful.
negative	I was about 8 years old when I was first introduced to the Hobbit from the animated 1 hour movie. The movie was a yearly event. As a child, it freaked me out. But, my Dad loved Glenn Yarbrough and the music, so, I was made to sit through it.
negative	THE QUALITY OF THE FILM Imagine "Spy Kids" with elements of Tolkien's writing. Technological demonstration, a large budget at the hands of a tasteless creative group.
positive	I was a mere child when I watched LOTR franchise and I still liked it. Ever since, year by year, I grew fonder and fonder of the movies and they remain, and probably forever will, one of my favorite movies of all time.
positive	The movie is amazing. It is unlike anything I've ever experienced in a cinema. The vividness of the colors and light and movement is something to behold.
negative	If misstepping were an aerobic exercise, Peter Jackson would be in excellent shape. Although I am loath to admit it, this adaptation of "The Hobbit" is unsatisfactory in many, many ways.
negative	This is the first of three films Peter Jackson has made to adapt J.R.R. Tolkien's prequel to Lord of the Rings.
positive	The Hobbit: An Unexpected Journey brings back the magic of Middle Earth, but I think it's unfortunate that it will experience the inevitable comparison to The Lord of the Ring
positive	Some love stories are built on passion, some on courage and some on hope. Very rarely do you come across a love story that encompasses itself around a journey.
negative	I am bitterly disappointed by this film. It's noisy, jumbled, and chaotic, far too violent (it was a children's book, for heaven's sake!), and almost completely formless.
mutual	Watched the IMAX 3D HFR version.
positive	Firstly, I have to make a statement- the LOTR movies, for me, have set an impossibly high bar both in this universe and within the movie world as a whole. Their cinematic beauty and value cannot be denied.
positive	This movie was so EPIC i'm speechless. I went with high expectations because Peter Jackson is awesome, but man, they weren't high ENOUGH.
negative	What a disappointment ! While I watched all LOTR movies with great enjoyment, this one is just a movie created to fill someone's pockets.
mutual	On learning that The Hobbit, a 400 page children's book was to be extended over three films (Unexpected Journey being the first) it seemed Peter Jackson may have been seeking a compromise between the children friendly book and the more darker and foreboding LOTR trilogy.
negative	The movie starts out as a warm return to middle-earth, we get a nice background-story of how the dwarfs lost their hometown, Erebor, to Smaug, the gold-seeking dragon.
positive	"The Hobbit: An Unexpected Journey" simultaneously takes director Peter Jackson in two different directions. While at first glance it may seem that he is travelling over familiar ground, again tackling the fantastical world of J.
positive	A shortish book is drawn out to not one but three full-length feature films, the better to flesh out characters who need, uh, fleshing, and the better to tell every bit of the tale.
negative	The Hobbit is absolutely terrible. Maybe the most uninspired musical I've ever seen. Its like they reshot the lord of the rings with a veneer of hobbit overlaid on top.
mutual	The Hobbit suffers from all the faults of LOTR but to a greater degree.
positive	First off I have never read The Hobbit, but from what I gather the book isn't all that long, so the fact that this film is the first of three, suggests they may be milking it a little.
positive	I absolutely adored LORD OF THE RINGS especially the first film Fellowship Of The Ring and when it was announced THE HOBBIT was going to be turned in to a film I looked forward .
mutual	Okay, I'm a big fan of the LOTR franchise. I was eagerly awaiting this movie and looking forward to seeing it. Maybe I was expecting too much, but I found it a colossal disappointment in multiple areas.
negative	Martin Freeman plays young Bilbo Baggins who's been given the role of Burglar in a quest to reclaim some hill once exploited by The Dwarfs that since long has been domiciled by a nasty dragon named Smaug.
negative	When I first heard that Peter Jackson had decided to make "The Hobbit" into three movies I was rather surprised. "The Hobbit" is not a long or complex book.
negative	The Hobbit SUCKED. It's like Star Wars Episode 1, all effects, no character development or emotional content. No charm, no magic.
negative	Everyone expected The Hobbit to be a different movie from LOTR. LOTR is dark and sombre. The Hobbit is a children's book, albeit one that appeals to adults. We were expecting a lighter movie. What we got was a mess.
negative	I've read a lot of the reviews here and a lot of them have spot on information. So, I will keep this short and sweet:
negative	The Hobbit is a relatively short book written as a prequel to the Lord of the Rings trilogy. It is NOT a trilogy, and even though LOTR is comfortably presented as a trilogy, it was written to be one very long book in three parts.
negative	OK, that's what happens if you let a soulless illiterate with no knowledge nor respect like Peter Jackson direct a Nobel-winner's book into a movie.
negative	I was very disappointed by this movie and surprised by just how awful it was. I say this as someone who loves LOTR.
negative	The joy of reading the Hobbit is that it's a humble and somewhat gentle tale for children. Quite why Jackson et al have decided to turn it into a 3 episode overblown epic is unknown.
negative	The Lord of the Rings trilogy has always been heavy reading, a very somber story. But The Hobbit is much lighter reading and quite humorous.
negative	Often we are compelled to do something we wouldn't usually do due to a rush of emotion and indeed, writing my first film review is accompanied by sorrow, anger and disappointment.
negative	First, let me say the Lord of the Rings movies were all first-rate and stayed pretty close to the original Tolkien books. Unfortunately, The Hobbit is not, because it does not.
mutual	This is not a bad film. But it is not the film people are describing. The Hobbit is a children's book of approximately 300 pages.
negative	Oh boy, what a failure. An Unexpected Journey never even seems to start and the writing, which had to rely far more on original material than the first three movies shows the weakness of Jackson et al. They can hardly write at all it seems - the dialogue and humor is painful.
negative	I have to wonder if I saw the same film as some of the other reviewers...
negative	I saw the 48 frames per second, 3D version and at least in my cinema it looked crap. The 3D looked artificial, the colors were poor, and the image lacked sharpness. And of course it was 3 hours of this.
negative	Tolkien must be spinning in his grave. This movies bears absolutely no resemblance to the book, aside from the names of the characters and the general plot.
negative	Just saw "The Hobbit" in 2D and standard 24 fps. There is some good to be said about this movie: Many set-designs and landscape shots are quite beautiful (in case you missed the same set-designs and landscape shots in the Lord Of The Rings trilogy).
negative	This movie was really disappointing. Let me say that although I didn't read the LOTR books, I loved the movies. However, I did read The Hobbit.
negative	WARNING, will likely contain spoilers!
mutual	First to say, I'm a true fan of The Lord of the Rings trilogy.
positive	The Lord of the Rings has been a timeless epic classic that is hard for other fantasy, Tolkien wannabe movies to capture its magic and so far, director Peter Jackson is probably the only one who can capture it.
mutual	We waited until this weekend to see "The Hobbit", to let the crowds die down, so what I'm saying has probably already been said by several others. Still, let me put in my two cents' worth...
negative	Although The Hobbit was by far my favorite childhood book, Peter Jackson managed to turn it into the worst movie that I have ever seen.
positive	This is not going to be one of those long reviews, consisting of detailed writings about what was good or wrong, that is for you to decide, once it hits the cinemas.
negative	..yes the characters and the settings are good and Lord of the rings was riveting, but this . I am sorry Muppet Show in a big cave ... The action scenes are like Tom and Jerry.
negative	On the whole it wouldn't be bad, but the original story is vanishing in the flood of fight scenes. And it's way too much.
mutual	From the very beginning, "The Hobbit: An Unexpected Journey" seemed to be missing something. Despite an all-too-brief appearance by Frodo and the return of several "Lord of the Rings" characters (Bilbo, Gandalf, and others), the story never became very compelling.
positive	Xarnis's review: It seems I'm in the minority here, but I like this movie. I don't know of its because i've read The Hobbit, the trilogy, and the Silmarillion, or what.
positive	Beautiful cinematography, beautiful design, make-up, special effects. Everything is perfect. The cast is a joy to watch.
positive	The Hobbit has always been the little brother book of The Lord of the Rings. However, in their movie version, it feels the other way around.
mutual	While I admit to preferring the book versions of most works, I am not a literalist. Movies such as L.A.
mutual	If this and KING KONG are what Peter Jackson are capable of when he's given free rein, then someone please bring back the bit and bridle.
positive	I will say upfront that I enjoyed this film. As a definite fan of the LOTR series, it was nice to see many of the characters again in a different adventure.
positive	I have seen the movie four times: once in 2D and three times in 3D 48fps. More on technology issues at the end of the review. Now let me discuss the movie itself.
positive	Returning to Middle Earth felt a bit like a school reunion. I was pleased to be back, but slightly embarrassed and curiously unconcerned about former acquaintances. Two screenings caused me to wish they had left Tolkien's book well alone.
positive	It is the first time in my life when I can say that a movie is better that the book! Very good story, impressive special effects and a great sound make "The hobbit, an unexpected journey" a must see!
mutual	I don't know what is with Hollywood these days. They continue to turn out trash for movies or they create these nearly 3 hour movies thinking that longer is better.
positive	As this film opens an elderly Bilbo Baggins explains how the once great Dwarfs were forced out of their mountain kingdom by the dragon Smaug.
positive	Ten years ago, I laid eyes on Peter Jackson's Lord of the Rings: The Fellowship of the Ring, and instantly fell in love.
positive	As an avid movie watcher, I was very excited to hear two years ago that The Hobbit was indeed going to be filmed.
negative	Bilbo recast as RAMBO.
negative	Saw The Hobbit last night and was very disappointed. Having read The Hobbit & LOTR in the 70's and re-read a couple of times since I really enjoyed LOTR because they were as true as possible to the books.
mutual	I and some of my family went to see this last weekend and left the theater sorely disappointed. All of us had read The Hobbit during our teen years and complained to each other afterward that the movies dialog and recreation of events from the book were quite a bit off.
mutual	First off: "The Hobbit - an unexpected journey" looks absolutely amazing on a big screen, especially when viewed through 3D glasses.
negative	Before I start, let me first say that I LOVE the books... The Hobbit and the three that make up LOTR.
mutual	Missing The Lord of the Rings trilogy in the cinema is one of my biggest film related regrets. Granted, when I finally saw them a few years later, I dragged myself through a Fellowship and Two Towers VHS and couldn't stand them.
negative	As much as I was looking forward to this film, I have to say it is by no means brilliant. The only thing that kept me in my seat in the cinema was the hope that it would remain as faithful to the book as it does in the beginning for the remainder of the film. Sadly, not so.
negative	Despite many deviation from the books, I enjoyed The Lord of the Rings movie trilogy (especially the first movie).
negative	I hated pretty much everything about this movie, but here are the main points:
positive	My conclusion upon watching this film and talking to others about it, is that if you are a fan of the Tolkien Universe, and not just the individual stories, then you will be a fan of this movie.
negative	This movie is bad. Really bad. About the only good thing I can say about it is that I am not being forced to watch it now. Oh, and Gollum was done reasonably well I suppose, as far as that goes.
positive	I am a huge movie buff and also a huge Lord of the Rings fan. So, when I heard that director Peter Jackson was finally directing the Hobbit, I immediately ordered my ticket!
positive	The Hobbit: An Unexpected Journey is the first installment of a projected three-film adaptation of JRR Tolkien's "the Hobbit", the first fantasy book written by Tolkien taking place in the mythical "Middle Earth".
mutual	My friends and I go to the Cinema almost every week , all 3 loved LotR, all 3 thought this movie was a waste of time , literally a waste of time on account of the first hour , nothing happening at all.
mutual	OK, not a complete miss but it was not what I was led to believe it was going to be.
negative	I watched this movie in 3D HFR. If you find 3D movies dim of light and a headache, you will not find any improvement in this new tech.
negative	About a decade ago, Peter Jackson concluded his film adaptation of J. R. R. Tolkien's Lord of the Rings trilogy and swept the awards with "The Return of the King".
negative	far too long, drawn out and boring. I actually got up and walked away for a bit to get some fresh air then came back and watched the rest.
mutual	I am a Tolkien fan having read LOTRs and The Hobbit many times (over 20). I loved Peter Jackson's LOTRs trilogy despite his skateboarding Legolas and slapstick version of Gimli. Gollum was one of the greatest characterisations I have ever seen.
positive	Hobbit Unexpected Journey is in my opinion an average movie. I just don't get it why people would consider it to be one of the greatest movie ever made. There are several reasons in mind:
positive	Well, I don't want to write too much. But all I must say here is that I didn't expect anything from this movie due to the buzz and sheer disappointment of some critical reviews that I read.
positive	i liked this movie it has what you may want from a fantasy action drama but compared to the lord of the rings trilogy well sadly it fails,what really went wrong with the hobbit ?
negative	OK, to be fair this is not a 1/10 movie. But it is so far from being a 10/10 and a top 250 movie that I felt the need to make a point.
negative	Wasn't impressed, not in the least.
positive	I thought the Lord of the Rings trilogy was excellent!! So, when "The Hobbit" came out, I was extremely eager to see the film... until I started reading reviews. Life got in the way of me seeing the movie in theatre, but I ordered my copy on Blu-Ray.
positive	Tolkien's "The Lord of the Rings" is a mighty epic fantasy, well over a thousand pages in length in most editions. Although Tolkien intended it to be a single novel, his publishers, for commercial reasons, issued it as a trilogy.
mutual	The Hobbit is an enjoyable enough movie, although it's too long. This is a children's book, it doesn't need endless LOTR tie-ins and the other additional material.
positive	I went to see the Hobbit last night, I walked into the cinema afraid that the film wouldn't be very good, at least compared with The Lord of the Rings. I was very wrong.
positive	So this is my first time writing a review on IMDb so I'm going to warn everyone that this may contain spoilers!
positive	I Wasn't really exited about this movies since the second I heard they were making three of them, from ONE amazing book, then hearing it'll include other stories was too much for any purist J.
positive	Watched 'The Hobbit: An Unexpected Journey' last week - and loved it. Great to be transported to Middle-earth and get reacquainted with some familiar faces - and meet many new ones too.
positive	I've only seen it in 24 fps so far. I'm never a big fan of 3-D movies, but I wouldn't mind seeing 2D 48 fps.
positive	For me this movie is a perfect fairytale movie that I wish I could have watched back when I was a kid. I am a grown man now but watching this movie took me back to my childhood.
positive	The Hobbit: An Unexpected Journey is an amazing movie! It's a great movie for the whole family. Full of amazing characters, great scenery, great action and great comedy.
negative	I thought this movie was so bad, much like Jackson's King Kong was really bad. It was SO overlong that I sat in the movie theater and pondered when it would end.
mutual	Let me start by saying The Hobbit was casted incredibly well. Martin Freeman was the perfect Bilbo, mostly due to his comedic timing with a good balance of heart as well (similar to Pipin & Merry in LOTR) that would have made the film to heavy otherwise.
positive	This is one of the movies that you either enjoy as a whole and try to overlook the negatives, or you be put off by its flaws, luckily .. I was among the first group.
positive	It's been nine years since Peter Jackson ended his epic retelling of J.R.R. Tolkien's Lord of the Rings saga, which in its lifetime garnered billions of dollars in worldwide gross, and won a combined total of 17 Academy Awards, including Best Picture for Return of the King.
mutual	I looked forward to the Hobbit with a sense of enthusiasm. I liked the Lord of the Rings trilogy, and forgave the examples where the films diverged from the book.
mutual	There is no denying that a production of The Hobbit has been a highly anticipated event ever since Peter Jackson and his team first began producing the Lord of the Rings trilogy just over a decade ago.
negative	After the LotR trilogy, my hopes weren't exactly high when I heard that Jackson was doing the Hobbit as well. They shrank even more when I heard that instead of two films, there was going to be three.
negative	The owners of the film rights of Tolkien's legacy naturally hope that each new instalment they provide will satisfy every demographically analysed sub-section of the massive potential cash cow (I mean audience).
negative	What an enigma this movie is. A great movie will have pages of positive reviews and high ratings, with an occasional negative comment here and there if appropriate. The Hobbit, however, has generated comments from both ends of the spectrum, from awesome to awful, and ratings from 1-10!
negative	You can tell by my rating that I didn't like this movie, but let's be fair. Despite my overall negative view of it, I still found some gems which are so good that I just can't bring myself to not mention them.
negative	8.5?! 94th on the top 250 movies of ALL TIME?! I found myself bored half ways through.
positive	I went to watch this movie with hope it would be another masterpiece by Peter Jackson like the trilogy Lord of the Rings. I was aware that the story and characters were going to be different but there was no need for such a different film  and not in a good way!
negative	The main problem with The Hobbit, as far as I can see it, is that it strays so ridiculously far from the original.
negative	I was a little sceptical going in as to how they could milk a 300 page book into three films (and long films too, dear God, this was long!).
mutual	I'm going to say upfront that the visuals were great and the 3D felt worth it for this film. The visuals and cinematography were the best I've seen since Avatar. However, it felt to be lacking in every other instance.
negative	I really wanted to like this film but it was absolutely dreadful. The HFR issue is a complete red herring; it's just a really bad film.
positive	I remember how bringing The Lord of the Rings to the screen proved difficult due to the sheer quantity of material offered in the literary template. The trilogy was a logical choice, yet even then a lot of condensing was needed.
mutual	I'm having difficulty sitting through these recent Peter Jackson films without getting bored out of my mind.
positive	When they announced The Hobbit would be made into a trilogy I thought it was a bad idea and after watching a Unexpected Journey I still think it was a bad idea.
mutual	There are two separate things I want to touch upon in this review. First is how it feels to return to Middle Earth and sit through yet another epic 2 hour 50 minute journey.
positive	The Lord of the Rings movies are some of my favourite films of all time, and The Hobbit: An Unexpected Journey comes close, but a few problems hold it back from being truly fantastic.
positive	I tried defending this film to my friends after seeing this. I told them that it's based on a children's book and is supposed to be whimsical.
mutual	I approached The Hobbit: An Unexpected Journey with trepidation, fearful that Peter Jackson, a director whose career was born of excess, would go unnecessarily way over the to
positive	*** Warning, this review may contain a spoiler ***
positive	Beyond the height of quality to expect from these creators (the ones also of the lord of the rings), The Hobbit an unexpected journey is a true middle-earth adventure that is a wonderful place to re-visit.
positive	First of all: what was with the singing? The Hobbit was very much parallel to the LOTR trilogy in regard to storyline and setup (meet, different battles, let's meet the dwarfs, let's meet the elves).
positive	THE HOBBIT: AN UNEXPECTED JOURNEY
negative	Let me open by saying that I totally enjoyed the Lord of the Rings trilogy and watched all three parts a total of four times to date. I savoured the texture and sheer quality of almost every aspect of these works.
negative	First off: I was very excited about this movie. Being a LOTR fan, I was expecting something grand.
mutual	Padding. Padding padding padding.
mutual	Peter Jackson's The Hobbit: An Unexpected Journey is a fantastic movie, but only if you've read the Silmarillion and drew obscene pictures of elves as a kid.
mutual	...and if it weren't for the top-rank design and effects, I'd have likely never gotten through it. As it is, it took me three days.
negative	I have to say, as a die-hard fan of the books, that this movie was blown for me in the first 20 minutes.
mutual	I am a life long fan of Tolkien. I've read The Hobbit and the Lord of the Rings trilogy countless times. Needless to say I was excited when the Lord of the Rings was made into a movies, or I should say, movies.
negative	I liked the movie L.O.T.R., i liked the novel The Hobbit. I watched this movie with curiosity how the charme and the esprit of this great novel would be adapted.
negative	If I didn't know anything about The Hobbit, and saw this film, I might have rated it a 7 of 10... i.e. not a great film, but fairly entertaining.
positive	After the critical acclaim and commercial success of the Lord of the Rings movies, it was somewhat inevitable that the Hobbit would also be given the big screen treatment.
positive	Firstly I have to say that I actually think the hobbit is not a well written book. In my opinion too much is left unsaid both in regards to characters and plot.
positive	Good adaptation of Tolkien's book, well-fitting with the earlier Lord of the Rings films. Overall very satisfying. The visual sweep and grandeur of this film conveys everything I would expect from a filmic adaptation of Tolkien.
positive	I know there are loads of these types of threads already, before I watched the movie I looked at them and everyone was complaining...
negative	Now I'm just as happy watching a slow burn film as an all action epic, but this felt like Peter Jackson had spent 3 hours rubbing two sticks together and failed to get a single glow.
positive	I went to see the Hobbit with not much expectation of seeing Great Story. I already knew that the special effects and imagery would be beyond comparison. The acting would be very high-class.
