negative	It's like the Star Wars prequels but less bad. The characters and the story are OK but for some reason the emphasis is put on **SpEcIaL!**EfFeCtS!**. As if we cared.
positive	I believe The Hobbit has the same soul and energy level the LOTR series maintained in fact at some point I even felt more excitement.
positive	I am a huge fan of "The Lord Of The Rings" series... I love those three movies of TLOTR.... So I was so much excited about "The Hobbit : An Unexpected Journey".
positive	The mysteries of middle earth are being murmured :p Precious Gollum is back on the screen :p Peter Jackson did not frustrate me at all.
positive	The Hobbit: An Unexpected Journey is a fine return to form for director Peter Jackson. Guillermo del Toro, who's one of the writers for the film, was initially supposed to direct but he left the project in May of 2010.
positive	Actually, I've already written everything in the summary.
positive	I had not read any of the books or watched any of the films before so this was a voyage of discovery and at the end of the nearly three hours I was captivated by this film.
mutual	¨My dear Frodo, you asked me once if I had told you everything there was to know about my adventures. Well, I can honestly say I've told you the truth, I may not have told you all of it.¨
positive	The Hobbit tells the tale of a young(er) Bilbo Baggins (Martin Freeman) who is dragged into a quest to reclaim the lost Dwarven kingdom of Erebor from the dragon Smaug, who has overthrown it.
positive	The Hobbit is one of the best movies this year and why? to answer that let's go into detail and start with what else but the beginning.
positive	The film is an excellent tribute to the original novel, it is a more mature version of it. While The Hobbit: An Unexpected Journey does not reach the standards created by The Lord of the Rings trilogy, it fits quite well in the LOTR filmography and universe.
positive	Peter Jackson already proved himself to be the worthy director to shoot this film - The Lord Of The Rings trilogy was stunning and shot with care.
negative	I was waiting for something much more that i was getting. First of all i didn't know it was going to be another trilogy, so my expectations where higher than "first piece of trilogy" but still...
negative	The studio films these days are not looking to make great films like they used to, they are just going after customers money and making people waste 3 hours of their life's wh
positive	I did want to see this movie because it was one of those 'must see movies' that appear in the cinema from time to time (and some of those movies are actually good) but I was actually surprised as to how well this movie was done.
positive	"Lord of the Rings" in 2001-2003 brought to the creators 17 Oscars and the international recognition for Peter Jackson  until now he is called one of the best directors nowadays.
positive	The Hobbit had a lot to do, a prequel to the all conquering Lord of the Rings trilogy, a smaller book, aimed at a younger audience but it doesn't seem to have hampered the film.
negative	This is not 2001 anymore. Lot has been changed. Yet this movie remains the same. > In this movie no major villain die :( > In this movie nobody achieve nothing > And the worst part is when some one is about to die or slain, there comes help immediately bullshit.
positive	Peter Jackson is at it again pushing the limits of what the cinematic medium can do.He harnesses the power of 3D and marries it to his innovation of shooting at 48 frames per second.
positive	From a long awaited impatience, i went to see this film as soon as possible, and it did not disappoint.
positive	There is no chance that any commentators have as much Tolkien knowledge as I do, and besides for the fact that I cannot write well, I will freely admit as a hardcore fan of th
positive	I went to go see The Hobbit this evening with my mother and I was extremely pleased. As a 22 year old fan of the movie series, I was impressed with the way that the characters I remembered so well from the other films were handled.
positive	Brilliant film, enjoyed every minute of it. As a fan of the LOTRs trilogy it was great to revisit middle earth in all its glory. Excellent performances from Martin Freeman and Ian McKellen.
positive	If you liked The Lord of the Rings than you will fall right in love with The Hobbit. It is an incredible story that will make you wanting to ask for more.
mutual	There are lots of people rating this movie as the greatest thing ever, but really if you compare it to the original series you'd have to admit it falls far short.
positive	Having enjoyed the first three movies that Peter Jackson managed to shake out of his creative sleeve, then of course I had to watch the prequel as well.
negative	The entire movie is just... the party walking 10 feet, fight some orcs, party walking 10 feet, fight some golems, party walking 10 feet, fight some goblins, party walking 10 feet.. fight something else.
positive	Let me start by saying, I'm a huge fan of LoTR, I've red the book about a dozen of times starting from 1979 until a few years ago, and I didn't like Jackson's treatment of the story.
negative	It had good parts. I enjoyed Martin Freeman's performance in the earlier part of the movie, and the earlier part of the movie in general - because it did play to human interest, but this rapidly evaporated.
mutual	Overly long with nothing much happening for long periods. The pace of the film was pedantic at best and I found myself losing interest quite easily.
positive	I grew up to the Lord of the Rings trilogy, and am a huge fan of the films as well as the books.
positive	A quiet and peaceful hobbit, Bilbo Baggins, having never known danger and adventure, is called to suddenly embark for an unexpected journey.
mutual	The two things that make "An Unexpected Journey" not that good as we all have hoped are its length and the inappropriate funny stuff Jackson mixes into it.
positive	I'm going to start by admitting, I'm not the biggest fan of fantasy, let alone The Lord of the Rings. I can see why people love them, they are well directed films and look magnificent.
positive	Let us look at the negative first.
negative	Lets keep it simple the thing is boring like hell.
negative	100% disappointing. How these guys managed to destroy a well written and interesting story? For me it is a mystery. Tolkien was a master of storytelling but you can hardly recognize his work in this farce.
negative	I loved this movie up to about the half way point. Then it fell apart big time. Actually painful to watch. (you sheep people should tell the truth).
negative	The Hobbit is a really good story, but what is it about a director who cannot even get the rhetoric of storytelling right, when the material is there already in the book. This is a real pity. Most of the story takes place on the road, but it felt more as if battles took up the bulk of it.
positive	Having read the Hobbit recently, it was easy for me to notice the little changes made to the story, some Tolkien fans will complain but not me!!
negative	First and foremost a movie should entertain. This one did not, it was boring beyond imagination. Making a 300 page book into 3 over-length movies without adding any new material simply can not work.
negative	A fantasy film produced to the highest possible standards. The music swells and toots with power, the cast offers charming and hilarious performances, and the set design, effects, costumes and props are all meticulously reproduced.
positive	Watching the Hobbit : unexpected journey was like a reunion. Saw the Hobbits village, their unique house, Frodo, Gandalf and.. Gollum. I can't believe I can still see them again, in a new story. for me LOTR series was ended in third movie. I remember how sad I am to see the story had finished.
mutual	Peter Jackson and company get an awful lot right here but the first part of his epic 'Hobbit' adaptation is largely an overblown mess. The flaws of his 'Rings' adaptations are ultra prevalent here. What we get here is an over complicated and thematically schizophrenic mess.
positive	I do admit, I had high expectations for this movie. I just finished the book as it released. I loved the mythology in this movie. I loved the action sequences and the visual experience.
mutual	Pros: Good music, many beautiful visuals and details, good casting, good acting when the CG is toned down (Gandalf and Galadriel; Bilbo and Gollum etc.), fun variety of locales and monsters.
negative	P Jackson totally missed the flavor of the book. I understand trying to make a movie that meshed with LOTR movies but it very loosely followed the book.
positive	I took my son to see this as a Christmas treat for him. And discovered three things about the Hobbit I did not know before:
positive	I went into this movie having read the book and pretty much knowing what to expect, after reading many reviews of all kinds.
positive	I never thought anyone could turn a book like The Hobbit into 3 movies, but Peter Jackson has in his interpretation of Tolkien's classic. People expecting a replica of the book will be disappointed.
negative	As many people have written long reviews, I will make mine short and to the point.
positive	Let me start off by saying that I'm a huge fan of the Lord of the Rings films and novels. In fact, they are my favorite films of all time and I watched the trilogy at least 5 times since last year!
positive	I was so desperate to see this movie! So, so excited and I was ready to argue with everyone who didn't like it, but...how awful I felt when I saw it! I mean, what happened? What went wrong?
mutual	The obvious has already been stated by almost everyone  The book is simply too slim to support a 9 hour movie trilogy and what's more it isn't serious or even "epic" enough to sustain such a treatment.
mutual	We went along to the cinema having been given tickets by someone who couldn't go. Turned out we were going to see the 3D version filmed in 48 frames per second (fps).
mutual	People will always compare it with the LOTR trilogy, consciously or otherwise. And that is the biggest challenge facing the Hobbit trilogy. After watching it my first comment was, it should have been made before the LOTR trilogy.
mutual	Years ago, when it was announced that Guillermo Del Toro would direct the prequel to the Lord of the Rings and that Tolkien's classic would be turned into two movies, people were skeptical that it could be done.
mutual	I was afraid this would happen after the 48 fps issue was so hyped. Just like Star Wars prequels, this movie does not try to be good. It tries to maximize profit at the expense of quality.
negative	A few days ago I saw this movie and I hated it. About half way through I was planning on just walking out, but I felt self-conscious because I was near the front of the audience, so I waited for a darker scene, but it never came.
mutual	I was actually fairly disappointed in 'An Unexpected Journey' if I'm honest, I am a major fan of the lord of the rings books and the films, in fact the collectors edition, directors cut LOTR films may be the best films out there, however I can not say that The Hobbit will be joining them.
positive	Long before he took the helm of "The Lord of the Rings" trilogy, New Zealand born Peter Jackson had acquired both a name and a reputation for himself as an independent splatter-gore horror movie maestro.
negative	This film wasn't made for the LOTR fans; it was made for those who were born after the LOTR was made.
negative	Peter Jackson has done it again. He has created an all-encompassing epic saga of Tolkien's Hobbit book, and after coming away from the first chapter, how does this rate not only as a film on its own, but as a part of the whole?
mutual	It's been nine years since we last saw Peter Jackson's tackle Tolkien's fantastical world on the big screen, but now the New Zealand filmmaker returns with The Hobbit: An Unexpected Journey.
positive	Hello there, its my 1st review. OK here we go. This movie is AWESOME i was waiting for it the whole year. It is almost as it is in a book (I read the book around 1000 times).
positive	"The Hobbit: An Unexpected Journey" takes us back to middle earth and this trip back is even better than what I remember of it.
positive	I really don't understand all the hate that seems to surround this movie.The Hobbit: Is an amazing movie! It's a great movie for the whole family.
positive	Ugh, there is just so much about Peter Jackson's return to Middle Earth that I wish had gone better. My expectations were high for the first HOBBIT movie, but I did my best to keep them in check.
positive	I never came around to read the LotR books before watching the movies and I actually haven't done that until now (so maybe shame on me), but I did read 30-40 pages of the Hobbit.
positive	Its not as bad as some say, but its not as good as the LOTR films were.
positive	People say that this movie is not connected to The Lord of the Rings, and if you review it from that angle, not from LOTR perspective, this is one really good movie!
positive	The Lord of the Rings trilogy is one of the most outstanding achievements in filmmaking history. They have a great story, great characters, great effects and just a great feel to them.
positive	I'm one of the biggest Lord of the Rings fans imaginable, actually I spent my entire youth in Middle Earth and some part of me is probably still there.
positive	Special effects are getting better and The Hobbit captures a bit of the magic from the Lord of the Rings trilogy from a decade ago. 10 years of CGI advancement show a noticeable improvement.
positive	After reading some of the bogus reviews regarding The Hobbit an expected Journey, I've decided to open up an account with IMDb to set the story straight.
positive	After The Lord of the Rings (best trilogy ever made), in which each film was truly a masterpiece, rumors emerged years later saying that Peter Jackson would make the movie "The Hobbit" inspired by the work of Tolkien, which tells the story before the events of Lord of the Rings, Mr.
positive	Well from the reviews I have read so far, I might be going against the grain here but I have actually voted this film higher than I did the LOTR trilogy.
positive	I first seen The Hobbit at the cinema in December and thought that it was a good and entertaining film. It was not until I bought the blu-ray release I realized that it's a great film.
positive	It's not Lord of the Rings and some people who I knew were disappointed with this film's juvenile humour obviously have either not read the book or understood that Tolkien wrote The Hobbit as a children's story.
positive	"My dear Frodo, you asked me once if I had told you everything there was to know about my adventures. Well, I can honestly say I've told you the truth, I may not have told you all of it.
positive	The Hobbit: An Unexpected Journey is a 2012 film directed by Peter Jackson, starring Martin Freeman and Ian McKellen.
positive	Doesn't have as much substance compared to "Fellowship of the Ring" but still a pretty solid movie. But "Lord of the Rings" has 3 separate novels that make up the trilogy and three separate movies.
mutual	The Hobbit: An Unexpected Journey is an adventure film with fantastic elements in it. If you liked the fantasy of Lord of the Rings, then you are surely going to love the fantastic elements of The Hobbit: An Unexpected Journey.
positive	Just wanted to say to everybody who thinks they have "milked" the story ore added things that do not exist in the original book. Yes there at lots of things in the movie which you can't read in the book "the hobbit"
positive	Peter Jackson's long awaited adaptation of J.R.R. Tolkien's beloved fantasy novel is finally here, nearly a decade after the last installment in Jackson's magnificent Lord of the Rings trilogy was released to cinemas in 2003.
negative	***SPOILERS***
positive	Peter Jackson's Awesome a director who knows how to edit a story and make the best of it, This movie on 3D is just awesome shooting and projection at frame rate of 48 fps makes it a first film, looks blurry at some scenes though.
mutual	I first became excited about this film having watched a few of The Hobbit's many lengthy pre-release production videos. In them the thirteen dwarfs were all laughing, having fun, and exuded an aura of infectious personality that had them poised to carry the film.
positive	The Hobbit is considered by many to be the finest work of fantasy ever written. Worldwide, somewhere between 35 and 100 million copies of The Hobbit have been sold since it was published in 1937.
positive	When I first heard the reviews from the 'experts' I was a little disheartened to say the least, but the truth is I shouldn't have been worried.
positive	The Hobbit is a prequel to lord of the rings. A young Hobbit (Bilbo Baggins), has a unexpected guest come over to invite for an adventure. (Gandolf) Bilbo kicks him out.
positive	The Hobbit is actually quite hard to review. With the hype (and outrage) surrounding the 48fps HFR filming, it was always going to polarise opinions. For my viewing, I chose the trusted 24fps 2D viewing, and my review reflects this version alone.
positive	Let's first just say that all of the haters of this film will always be haters, so i will not even bother trying to convince them, that this movie is good.
negative	I really struggled with what to rate this movie. I was such a fan of the Cartoon Version that I couldn't wait for this to come out! I'm so totally disappointed!!
mutual	In all honesty, I was disappointed by The Hobbit. The film didn't leave me with quite the same satisfied feeling as the Lord of the Rings did. Since then I've been thinking of the reasons for this... here are issues with The Hobbit:
negative	At the age of 12, I read the first book of this trilogy of J. R. R. Tolkien. I lent the books at the school-library, and somehow i still got them (17 years later).
positive	Ladies and gentlemen, boys and girls, orcs and hobbits, dwarfs, elves and trolls of all ages.
positive	I liked "The Hobbit" it was a great children's novel that served its purpose, and it was wildly effective at getting its points across.
positive	Even though the movie is not totally based on the book, the lord of the ring's fans won't be disappointed. The special effects and the music are magical and the performance of the actors great.
mutual	Let me get things straight first. I enjoyed "An Expected Journey" as I was viewing it. From the film's first half hour, I could tell that it wasn't going to be an event as grand and glorious as any of the "Lord of the Rings" movies, which was just fine by me.
mutual	I am a fan of the Lord of The Rings Trilogy, they're truly magnificent and convey a almost real-life feel that reading the books gives you. However, the Hobbit failed to match up to the trilogy.
negative	After Peter Jackson had made the Lord of the Rings in such a magnificent way, following the the plot of the books very satisfyingly, I was really looking forward to go see the Hobbit.
positive	I am a fan of the Lord of the Rings series and I had high expectations for this movie, it didn't quite reach those expectations but was still pretty good.
positive	As if the Lord of the rings series couldn't get any better, Peter Jackson manages once again to deliver s stunning masterpiece. The scenery chosen was perfect and went hand in hand with the book's tone.
positive	The heart that carries this movie is much more than the extension to the RINGS saga it may seem. The depth of landscape is on such a grand scale that it dwarfs (no pun intended) any other epic.
positive	well I'm going to keep this very short , iv been waiting for this since the announcement of the hobbit and after my excitement of watching it i can confirm i was not disappoin
positive	*CONTAINS SPOILERS*
positive	The Hobbit: An Unexpected Journey is the golden ticket that takes us back to Middle Earth where we can once again immerse ourselves in this deep, intricate and magical world.
positive	MAJOR SPOILERS AHEAD!
positive	I'm waiting for the next episode of this Soap Opera, because that's what it looks like in HFR. Skip that terrible miscarriage of video technology. Don't need the realism. Don't want the realism. It's freaking Middle Earth, for crying out loud, I don't want to see the glue in Gandalf's wig.
positive	After hearing so many, well, negative reviews I had almost decided not to check The Hobbit out in the cinemas. Fortunately a few well trusted reviewers said that it was actually pretty awesome.
mutual	Peter Jackson's The Hobbit has hit cinemas with a hype collected by his previous The Lord Of The Rings trilogy.
mutual	I've been waiting for The Hobbit ever since the LOTR trilogy. Didn't expect the same type of film, as it's source is a children's book after all, but I did expect to be entertained and enjoy great Middle-earth visuals.
positive	Movie Critics don't deserve to watch movies based on JRR Tolkien's literature. They are ignorant movie goers and don't understand the subtleties of the Tolkien universe.
positive	Bilbo the Hobbit is a film that just came to cinemas, and has been rated as an excellent movie. Strangely enough, some people rated it as a less good film than the Lord of the Rings.
positive	As a standalone movie The Hobbit is a good movie thats why i gave it a 7 but when compared to the LOTR movies it sucks the visuals are fake looking the big orcs and wolves are like cartoons and i watched it in 2D.
mutual	Well. That was certainly... something.
positive	I'll get this out of the way first: as a faithful adaption of the book, this fails. It misses the spirit of the printed Hobbit, attempting to graft on too many "epic this!
positive	Peter Jackson created something so reminiscent of LOTR that is looks like he is lacking new ideas. Many shots, scenes and even lines were almost copy-pasted.
positive	Expectations were high as I sat through the many advertisements to finally see the movie was about to start. Despite the many reviews that took made it out to sound that Jackson had lost his touch, I refused to believe that they were true and went to see for myself. And I am very glad that I did.
positive	'The Hobbit' is a novel written by J.R.R. Tolkien, consisting of less than 300 pages - significantly smaller in size than the three Lord of the Rings books.
positive	The Hobbit is a masterpiece and is well based on the excellent book 'The Hobbit' by J. R. Tolkien. The movie takes you on a journey of a lifetime and takes you inside the imaginary mind of Peter Jackson.
positive	It's been a long journey to the beginning, but here we are, finally.
mutual	I had high hopes for this movie after enjoying the Lord of the Ring, but The Hobbit proved to be a tremendous disappointment after its predecessor set the bar so high.
mutual	... if only it had not tried to blow a wonderful, short and sweet children's book up into an LOTR-style epic.
negative	We already have a long drawn out trilogy in Lord of the Rings and don't need another. The Hobbit should be a one off, one crack at it, one shot deal. Its to much, to long, to drawn out.
negative	After hesitating for a while between Django Unchained and the Hobbit, my wife and I chose to watch the latter. I read many bad reviews but some people also suggested that it was still worth seeing.
positive	I saw the digital HFR 3D version, not sure what to expect. I liked "Avatar", but there were times when the 3D in that movie was simply distracting, and to be honest I can't even recall now what it looked like, which goes to show how much of an impact it made on me.
positive	Just my 2 cents. I was afraid to go see this. I reread the book in prep. Peter Jackson did a great job filling in the gaps and matching the tone of LOTR movies.
positive	You've likely heard of the surprising critical reaction to Peter Jackson's Lord of the Rings prequel, The Hobbit.
positive	A new movie about from the hand of Peter Jackson about the Hobbits, what a pleasure to see.
positive	Many critics have stated that 'The Hobbit' is a disappointing film and that they were expecting to see something similar to 'Lord of the Rings' but they didn't.
positive	Why is this being hated upon so badly? I am a die-hard Lord of the Rings movie fan (and the Hobbit was the only book I read of Tolkeins LOTR novels!
positive	Tolkien's bed time story is revamped in a more epic fashion with Peter Jacksons return to the stunning world of Middle Earth in The Hobbit, a tale of a secluded, comfort lovin
positive	I found myself reading a number of mixed reviews from a vast array of critics this morning, trying to make some sense of what they were saying.
positive	There is two things you can't help yourself falling in love with, this type of tales, and peter jackson bring it up to the screen ..
positive	Having read the book a few times I was quite excited. Having seen the film I was disappointed. The film at times is just incredible, when it follows Tolkien's lead, and disappointing when it strayed from the book, namely for action scenes. 8/10 is an incredible mark, but I expected more.
positive	The Hobbit I is a very good movie. All the characters are well played, the story and the attention to details are amazing, as are the effects, the costumes, the music - in sho
negative	Despite being a big fan of Peter Jackson's earlier work, this time I must admit that the story did not captivated me as I expected and leaves much to be desired.
positive	I just saw The Hobbit: An Unexpected Journey and it was very disappointing. When I heard they were going to make 2(3) movies out of a very short book I expected them to use a lot of the backstory from The Appendices, The Silmarillion and Unfinished Tales.
